<?xml version="1.0" encoding="utf-8"?>
<curriculum  xmlns:xsi="http://www.w3.org/2001/XMLSchema-instance"
  xsi:noNamespaceSchemaLocation="proyecto.xsd">

  
  <datosPersonales>
    <nombre>Rocio</nombre>
    <apellidos>Contarino Cannobbio</apellidos>
    <fechaNac>2005-06-15</fechaNac>
    <lugarNac>España</lugarNac>
    <nacionalidades>española</nacionalidades>
    <nie>X1234567T</nie>

  </datosPersonales>

  <datosContacto>
    <tipoVia>tipoVia</tipoVia>
    <nombreVia>nombre</nombreVia>
    <numeroVia>5</numeroVia>
    <portal>2</portal>
    <escalera>3</escalera>
    <piso>2</piso>
    <puerta>A</puerta>
    <cp>18290</cp>
    <pais>España</pais>
    <email>nombre@gmail.com</email>
    <telfMovil>123456789</telfMovil>
    <telfFijo>123456789</telfFijo>
  </datosContacto>

  <datosContactoA>
    <pagWeb>librosycafe.com</pagWeb>
    <redesSociales>aa</redesSociales>
  </datosContactoA>

  <forAcademica>
    <nombreEstudio>DAW</nombreEstudio>
    <lugarEstudio>ies zaidin vergeles</lugarEstudio>
    <fechaInicio>2000-01-01</fechaInicio>
    <fechaFin>2000-10-01</fechaFin>
  </forAcademica>

  <idiomas>
    <nomIdioma>Inglés</nomIdioma>
    <nivelOral>Medio</nivelOral>
    <nivelComprensionO>Medio</nivelComprensionO>
    <nivelEscrito>Alto</nivelEscrito>
    <nivelComprensionE>Alto</nivelComprensionE>
    <titulo></titulo>
    <nivelTitulo>B2</nivelTitulo>
  </idiomas>

  <expLaboral>
    <lugarExp>ee</lugarExp>
    <puesto>ee</puesto>
    <fechaInicio></fechaInicio>
    <fechaFin></fechaFin>
  </expLaboral>

  <compSocPer>
    <competencia>
    <nombre>trabajo en equipo</nombre>
    <nivel>4</nivel>
    </competencia>
  </compSocPer>

  <datosAdicionales>
    <aficiones></aficiones>
    <disponViaje></disponViaje>
    <vehiculo></vehiculo>
    <permisoConducir>B</permisoConducir>
  </datosAdicionales>

</curriculum>